0,"Based on deployment, the market has been further segmented into cloud and on-premise"
0, Cloud and on-premise technologies are preferably deployed based on organizational needs and requirements
0, The on-premise segment accounted for the highest market share of over 60% in 2020
1, The growing demand and rising preference of organizations for different enterprise software and services that enable customization of software according to the client’s requirements are expected to drive the demand for on-premise deployment over the forecast period
0,Cloud services are being widely used in the global market as they minimize the need for a manual upgrade in enterprises and enable users to access data from remote locations in a hassle-free manner
0," Cloud-based services allow organizations to utilize and pay for only the amount of resources they need, which helps organizations minimize energy consumption and increase cost-effectiveness"
1," Furthermore, stringent government regulations for minimizing carbon footprint are encouraging organizations to opt for cloud-based services, which is expected to drive the cloud segment growth"
0,"Based on enterprise size, the market has been segmented into large enterprises and small & medium enterprises"
0, The large enterprise segment accounted for the highest market share exceeding 55% in 2020
0, Large and Small & Medium Enterprises (SMEs) deploy business software and services to strengthen the internal and external operational processes
1," Factors such as the use of advanced analytical engines, real-time data compilation tools, and process blueprints are driving the adoption of enterprise solutions and services in large enterprises"
1,The increasing preference among enterprises for efficient networking solutions and automation capabilities is expected to drive the demand for enterprise software and services in the large enterprise segment
1, The growing emphasis on strategic decision-making and resource allocation is expected to further drive the growth of the large enterprise segment
1," The increasing number of government initiatives, including digital campaigns such as social media marketing, video marketing, and search engine marketing, is anticipated to trigger the growth of the SMEs segment"
1, The growing importance of re-evaluating strategies and deploying advanced technologies in business processes is expected to drive the growth of the IT and telecom segment
1, Various organizations are expanding their operations to cater to larger markets; this is driving the demand for business solutions and services in organizations to efficiently offer solutions to their customers
0,North America dominated the global market with a share of over 20% in 2020
1, This growth can be attributed to the growing demand for high-speed data networks and the significant presence of software vendors in the region
0," Companies in North America are focusing on developing custom analytics and intelligence solutions, in addition to the implementation of software and analytics-based strategies, as compared to other regions"
0," Canada is home to a large, educated workforce of computer scientists, data analysts, and software engineers, who deal with enterprise solutions and services"
1, Significant investments by large corporations and the deployment of new technologies across businesses and enterprises are driving the regional market growth
1,The need for compliance with stringent government regulations among various industries in developing countries has triggered the implementation of business solutions
1," Rising consumer disposable income, spur in golf tourism, growing popularity of the sport, and development of golf courses across the world are some of the prominent factors driving the growth"
0,"Golf is played by more than 60 million people, in more than 130 countries from six continents"
0, The International Golf Federation organizes various programs and events across the world to attract millions of people of all ages to the game
0," With the addition of the sport in the Olympic Games, there is a sudden rise in the number of golfers across the world"
1,The number of young golfers has substantially increased in last few years leading to the purchase of various golf kits
1, This is one of the major reasons driving the demand for golf equipment
1, The substantial rise in the demand is also due to the increasing income of the middle class population and the number of female golfers over the last few years
0,"However, hectic schedules in young consumer group leads to increase in number of indoor games thus, hampering the demand"
1," Furthermore, high membership charges of the golf courses are also impeding the product demand globally"
0,"In addition, online discounts on the product can propel the demand in near future"
0, Rising popularity of golf among wealthy and upper class population is projected to bode well for the product demand in the forthcoming years
1, Increasing number of golf courses due to increasing golf tourism can further fuel the demand
0,"On the basis of distribution channel, the market is divided into sports goods retailers, online, and department and discount stores"
0," These retailers are generally present inside the golf courses thus, they generate the maximum revenue"
1," Furthermore, easy access, availability of the product, and variety are among the prominent factors for the segment growth"
1, These retailers also provide discount with the golf course membership which is also propelling the segment
0,"Apart from sports retailers, online is the fastest growing segment and is witnessing a significant CAGR of more than 4"
1," Faster delivery, discounts, assured dealers, and free replacements are among the prominent factor driving the growth"
0, Such factors are anticipated to positively influence the segment growth in the forthcoming years
0,North America was estimated to be the largest market in 2018 owning to growing popularity of the sport in the region
1, Changing lifestyle along with increasing income of the middle-class population is driving the regional demand
1," In addition, inclination of the consumers towards leisure activities is further fueling the growth"
1," Rising popularity of the sport in the region, particularly in china after the golfer Feng Shanshan winning a bronze in 2016 Olympics, is the major factor propelling the regional market"
0, The market poses a moderate to high entry barrier due to presence of big players and requirement for huge investments
0, These companies engage in innovations and R&D investments to provide the best gears to the players and to gain an edge over its competitors
0, They also engage in business expansions and mergers and acquisitions to gain greater market share
0,The global mens personal care market size was valued at USD 47.5 billion in 2019 and is expected to expand at a compound annual growth rate (CAGR) of 6
1," An increase in concerns related to health, body-image, self-grooming, and hygiene among men is the key factor driving the market"
0," Growing awareness about the importance of overall personal care regime coupled with emerging trends in fashion, and social media’s influence, towards aesthetically appealing looks, is also expected to boost the market growth"
0," According to the article published by Cosmetics Europe in 2019, 81.0% of men globally believe that health, hygiene, and looks influence their grooming products purchase decision"
0," From male skincare, makeup to manscaping, the market is a plethora of opportunities, with many new brands penetrating and aiming to change the way men are marketed to, and increase usage of personal care products will likely drive the market"
0,"Additionally, companies have been seeking the market for mens personal care as an opportunity to chase mens spending on personal care products"
0," Big players such as P&G, Reckitt Benckiser have expanded their product portfolio to cater to the market"
0," For instance, in November 2019 Reckitt Benckiser owned women’s brand Veet expanded its product offering to male grooming products with the launch of hair removal cream for men and soon would be launching more products catering to men’s personal care"
0,"In recent years, the notion that men cannot use beauty and grooming products has receded and the market is becoming a hotbed of promises"
0," Social media campaigns, digitally native startups, and international brands catering to the men’s personal care segment bode well with the market growth"
0," For instance, in May 2017 Procter and Gamble owned men’s grooming brand Gillette launched customized subscription model-direct to consumer model “Gillette on Demand” in which men’s grooming products such as disposable Sensor 3 razors, tri-blade Mach3 turbo, and Gillette fusion Proshield was offered and subscribers were offered free loyalty points in exchange on their orders"
0,The market has also witnessed notable mergers and acquisitions activity in the past five years
0," For instance, In September 2019, men’s skincare start-up Oars + Alps was acquired by SC Johnson, and Walker and Co manufacturer of Bevel, a shaving range for men, and was further acquired by Procter and Gamble in 2018"
0, The brand then launched a collection of skin and body care products in 2019
0,The recent Covid-19 outbreak has impacted the growth of the market for men’s personal care
1, An increase in the number of cases worldwide has led to a global lockdown and restricted supply chains
0," Consumer’s discretionary spending has reduced, and companies have been witnessing a behavioral shift towards safe and reliable products"
0," Moreover, personal grooming brands are focusing on strengthening their e-commerce channel along with offering at-home personal care products, and consumer engagement on their websites by hosting engagement campaigns"
0,"In terms of product, the skin care segment led the market for men’s personal care and accounted for 44.2% share of the global revenue in 2019"
1," An increase in product launches in the men's category has led to increased use of products such as creams, moisturizers, face wash, and serums"
1," The brand covers the full range of grooming products categorized into three sections such as shave and edge, trim and care which include products-razors and shave gel, beard trimmer, beard and face wash, beard balm, and "
1, The inclination of men towards corporate lifestyle and rise in the number of educated customers especially in emerging economies such as China and India is the key factor driving the market in the region
1," Factors such as pricing, quality of products, and a number of mid-range brands catering to men’s category continue to be a decisive factor in influencing consumer choices"
1," Growing consumer interest in plant-based diets, coupled with the rising awareness about animal rights, is expected to drive the market growth"
1,Growing penetration and rising adoption of the omnichannel approach is anticipated to support the e-commerce sales channels in the market
1," The Covid-19 pandemic, which led to the imposition of lockdowns in major cities across the globe, is expected to encourage online shopping"
1," The ability of the product to help maintain metabolic activities in the human body, including lipid synthesis and cell division, is projected to augment its demand over the forecast period"
0,"Furthermore, pea-based patties in burgers can be easily substituted in place of chicken, beef, or pork-based patties"
1," Various characteristics, such as high protein content, the resemblance in texture and consistency to meat, easy availability, and quick preparation are likely to spur the consumption of pea-based meat products"
1, The growing demand for innovative vegetarian products has led to a significant rise in new product development in this segment
1," This, in turn, gives the consumers a broad range of products and brands allowing plant-based meat goods to gain increased recognition and shelf space"
0,"Plant-based food products manufacturers are witnessing a significant increase in their revenues, with faux meat manufacturers seeing the most significant growth in their net sales"
0, The refrigerated plant-based meat products segment is likely to exhibit the fastest growth rate from 2020 to 2027
1, Various factors contributing to the growth of this segment are meat shortage and concerns regarding the coronavirus outbreak in the meat processing facilities
1,"Though the frozen plant-based meat products were consistently outpaced by their refrigerated counterparts amidst the pandemic, the same trend is projected to continue even after the pandemic owing to the growing environmental concerns and the rising popularity of plant-derived food products"
1," Many restaurants, fast food chains, and casual dining venues are dedicating a section of their menu solely to “meat-free” options due to the rising popularity of vegan and flexitarian diets, which, in turn, is projected to drive the segment growth"
1," The growth of the regional market is accredited to the growing consumption of meatless meat products, coupled with rising consumer awareness regarding the potential risk of consuming contaminated meat foods"
1, The demand for plant-based foods is projected to increase further on account of shifting perceptions of consumers around food sustainability and safety
1,The market in Europe is anticipated to witness the fastest growth over the forecast years on account of positive consumer outlook on vegetarian and vegan-meat products and stringent regulations against animal cruelty
1," Growing concerns regarding the side effects of chemicals on the skin, causing skin irritation, allergies, and skin dullness, have been one of the key factors fueling the market growth"
0,"Dissemination of knowledge related to the benefits of natural skincare has led consumers seeking eco-friendly, sustainable, natural skincare products that come with greater product ingredient transparency"
1," According to the Asia Cosmetics report, in 2017, globally 40% of the change in the buying decision of the consumers has inflected because of natural ingredient listing on the packaging"
1,Rapid growth in the number of new companies and startups pertaining to natural skincare has led to the availability of affordable products and innovative product lines in the market
0, Major consumer brands are considering launching natural daily use of
0,The recent Covid-19 outbreak has severely impacted the growth of the beauty and personal care industry
1, The pandemic disrupted production as well as sales of beauty and skincare products through both online and offline channels due to social distancing and stay home policies
1," The high concentration of manufacturers offering natural skincare products, which can be used on a regular basis while keeping the product affordability in mind, is a primary reason boosting the growth of this segment"
1, Quality and extra value-added offerings are the key factors driving the market
1, Growing preference for natural skincare products to avoid breakouts and skin irritation caused by chemical skincare products is among the key factors fueling the segment growth
0," Women are more concerned about the appearance than men, and thus pay more attention to their skin and the quality of products they use for it"
0," This has led manufacturers in the natural skincare industry to venture into relatively novel categories, such as facial masks, face wash, lotions, and serums"
1," Rapid urbanization, along with a gradual increase in the number of working-class women, has augmented the demand for natural skin care products, thereby driving the consumption of chemical-free beauty products across the globe"
0,The men segment is anticipated to expand at the fastest CAGR of 5.2% from 2020 to 2027
0, Growing awareness among males related to grooming and skin nourishment globally has been driving the demand for men’s natural skincare products over the years
0, This has encouraged manufacturers to focus on the male skincare product line
0," For instance, in June 2019, Armani Beauty announced the launch of a new line of environmentally responsible men's grooming products, including face wash, toner, and moisturizer, featuring natural and biodegradable formulations, which ensures that up to 99% of ingredients are derived from nature"
0,Hypermarkets and retail chain distribution channels dominated the market and accounted for 41.7% share of the global revenue in 2019
0, These stores have been focusing on offering natural and chemical-free categories set up to pique customer interest and offer them a facility to choose from numerous brands before making a purchase
0," Moreover, many retailers are focusing on revamping the product portfolio in the stores owing to the popularity of natural products"
0," For instance, in April 2017, CVS Health, a retail chain, announced the removal of approximately 600 beauty and personal care brands offering parabens, phthalates, and the most prevalent formaldehyde"
0," Moreover, in August 2017, Walmart, another retail chain, launched a natural beauty line called Found, which includes 133 natural skincare and beauty products and would be available in offline stores"
0, These strategies by brands tend to gain more consumer engagement and trust
1," The inclination of consumers towards natural products is expected to shoot up demand for such products, especially in developing countries, such as India and China"
1," The rapid increase in the volume of enterprise data and growing automation of business processes across several end-use industries such as retail, manufacturing, healthcare, and transportation are expected to drive the demand for business software and services over the forecast period"
1," Significant rise in deployment of enterprise software and services across IT infrastructure for enabling better strategic decision-making, reducing inventory cost, enhancing profitability, and enabling organizations to improve their market position is estimated to drive the market growth over the forecast period"
1," Furthermore, the rising adoption of advanced technologies such as blockchain, hybrid architecture, artificial intelligence, and machine learning is expected to contribute to the growth of the market over the forecast period"
1," According to an NTT Ltd report commissioned by International Data Group, Inc (IDG), the normalization of the work-from-home model amid the local and global quarantine situation has increased the demand for value-added services for reducing security risks"
1,Higher costs of licensing and the need for timely support are the major constraints for the market growth
1," The increasing importance of financial management tools across businesses and enterprises for planning, budgeting, analysis, and reporting is expected to drive the growth of the finance segment"
1, Financial management software is extensively adopted in the BFSI industry in North America owing to the need for risk compliance and improvements in efficiency & productivity of operations
1, This dominance can be attributed to the rising popularity of business management solutions and the emergence of software models to detect & fix issues pertaining to the quality of a product
1," The growing demand for third-party support & maintenance services, owing to cost-effectiveness, and for well-trained and experienced technicians is expected to propel the growth of the segment over the forecast period"
0,The managed services segment is anticipated to emerge as the fastest-growing segment over the forecast period
1, The increasing dependence of enterprises on IT assets and infrastructure to improve their productivity is anticipated to drive the growth of the managed services segment
0, The consulting services segment is anticipated to witness considerable growth over the forecast period
1, The growth of the segment can be attributed to the increase in demand for various consulting services in end-use industries for managing risks and identifying growth opportunities for future development
