 0,The global vegan women’s fashion market size was valued at USD 396.3 billion in 2019 and is expected to grow at a compound annual growth rate (CAGR) of 13.6% from 2020 to 2027
 0,The market is driven by the growing popularity of vegan clothing and accessories made from cruelty-free sources among the millennial population across the world
 0,"Many renowned personalities such as Pamela Anderson, Joaquin Phoenix, Christy Turlington, Alicia Silverstone, and pop star Pink are choosing vegan fashionable clothes, which is influencing people to conscientiously choose cruelty-free apparel. The growing perception among consumers that animals are sentient beings with feelings similar to humans has been contributing to the greater social acceptance of these products, thereby driving their demand"
 0,Increasing disposable income and consumer spending on luxury products are some of the other prominent factors augmenting the demand for vegan fashion apparel worldwide.
 0,"The market for vegan apparel is still at a nascent stage, with a greater number of new manufacturers venturing into this market"
 0,"However, in the wake of growing consumer awareness about animal products and animal cruelty, established brands have also been turning towards veganism by abstaining from the use of animal products"
 0,"For instance, in 2018, Guccio Gucci S.p.A announced its willingness to go fur-free, starting with its 2018 spring collection."
 0,"Similarly, other famous companies that are already restraining from the use of fur include Calvin Klein, Ralph Lauren, and Giorgio Armani"
 0,"The acceptance of fur-free fashion apparel by a number of renowned brands is having a trickling down effect on the fashion industry of developed countries, such as the U.S., the U.K., France, and Germany"
 0,"For instance, based on a report by Apparel Resources, in 2018, there was a 41% decline in women’s fur arrivals in the U.K.’s women fashion market alone."
 0,Covid-19 has had a devastating impact on the fashion industry
 0,"Store closures due to quarantine and lockdown measures have resulted in disastrous consequences, with sales decreasing considerably from January to April 2020"
 0,"This has also impacted the sales of the vegan fashion drastically as the major consumer base of these products is present in Europe, which is severely affected by the pandemic"
 0,"In addition, the pandemic situation has goaded people to spend more judiciously and avoid frivolous purchasing"
 0,"People have been refraining from buying luxurious clothes and vegan apparel, which usually fall under the premium category."
 0,The vegan footwear segment led the market and accounted for 41.3% share of the global revenue in 2019
 0,"Vegan footwear made without the use of animal by-products or materials, including leather, suede, wool, and fur, offers an elegant and sober look to the wearer, which has multifold the popularity of these shoes among women of all ages"
 0,Vegan alternatives such as microfibers including 
 0,First-time buyers of vegan footwear intend to portray a specific image in the society as people are raising their voice against cruel and inhumane behavior towards animals
 0,"Moreover, footwear is more of a fashion statement among women in particular, with their intention to have more than one shoe to suit different occasions, which is driving the product demand"
 0,"Vegan shoes offer more uniqueness to the footwear in terms of design and materials used, which has piqued the interest of fashion-forward consumers worldwide."
 0,The vegan clothing and apparel segment held the second-largest share in terms of revenue in 2019
 0,"Vegan women’s fashion basically comprises clothing and apparels made from cruelty-free sources, which signifies that neither are animals harmed in the manufacturing process through testing nor are any materials pertaining to animals been used for the development of the product"
 0,"Whilst pandering to a niche audience in the market, these products have been witnessing high receptibility by consumers, which is fueling the segment growth."
 0,"Based on the distribution channel, the market is segmented into hypermarkets and supermarkets, departmental stores, specialty stores, and e-commerce"
 0,Specialty stores dominated the market and accounted for 31.4% share of the global revenue in 2019
 0,Consumers prefer buying vegan women’s fashion products from these stores owing to the availability of a wide variety of vegan products from different brands under one roof
 0,"Furthermore, many specialty stores dealing in sustainable and animal-friendly fashion concepts maintain a considerable depth in terms of the products they offer to ensure quality service"
 0,"These stores also provide professional guidance to customers, which is one of the prominent factors driving the segment."
 0,The online distribution channel is expected to witness the fastest growth over the forecast period
 0,"The major factors fueling the growth of this segment are increasing internet penetration, doorstep delivery facility, easy exchange offer, and hassle-free payment option provided by the e-commerce companies"
 0,"In addition, internet-savvy millennial consumers have been actively driving e-commerce sales."
 0,North America dominated the market for vegan women’s fashion and accounted for 34.6% share of the global revenue in 2019
 0,Increasing demand for stylish and comfortable vegan fashion apparel is fueling the growth of the market in the region
 0,"Many brands such as Keep Company and Unicorn Goods have been offering fashionable apparel, such as vegan shirts, jackets, and accessories, to attract conscious customers looking for animal-free clothes."
 0,"In addition, a considerable number of celebrities in the region have been promoting the concept of veganism in the fashion industry in the region"
 0,"For instance, in March 202 0, Serena Williams launched a vegan fashion line for women"
 0,"The “S by Serena Spring 2020 collection” features various types of designer apparels made from animal-free leather, including the Sasha vegan leather blazer and the Sasha vegan leather pant."
 0,"Followed by North America, Europe is a prominent regional market for vegan women’s fashion products"
 0,"Consumers in this region are more product conscious in countries, including the U.K., Germany, and France"
 0,"According to the London-based retail technology company Edited, by the end of January 2019, there was a 5% increase in products described as a vegan in the U.K"
 0,year over year
 0,The presence of numerous vegan fashion manufacturers in the region is also driving product demand.
 0,"Prominent market players are likely to focus on establishing their businesses in the Asia Pacific owing to rapidly expanding customer base in countries, such as India and China"
 0,"In this respect, key market participants are expected to invest in research & development activities to remain competitive over the forecast period"
 0,Some of the prominent players in the vegan women’s fashion market include:
 0,GANNI
 0,ENVELOPE 1976
 0,THOUGHT CLOTHING
 0,Mayamiko
 0,Whimsy & Row
 0,Reformation
 0,FAITHFULL THE BRAND PTE.LTD
 0,Stine Goya
 0,Hiraeth Collective
 0,Market size value in 2020
 0,USD 336.9 billion
 0,Revenue forecast in 2027
 0,USD 1095.6 billion
 0,Growth Rate
 0,CAGR of 13.6% from 2020 to 2027
 0,Base year for estimation
 0,2019
 0,Historical data
 0,2016 - 2018
 0,Forecast period
 0,2020 - 2027
 0,Quantitative units
 0,Revenue in USD billion and CAGR from 2020 to 2027
 0,Report coverage
 0,"Revenue forecast, company ranking, competitive landscape, growth factors, and trends"
 0,Segments covered
 0,"Product, distribution channel, region"
 0,Regional scope
 0,North America; Europe; Asia Pacific; Central & South America; MEA
 0,Country scope
 0,The U.S.; The U.K.; Germany; France; China; India; Brazil
 0,Key companies profiled
 0,GANNI; ENVELOPE 1976; THOUGHT CLOTHING; Mayamiko; Whimsy & Row; Reformation; FAITHFULL THE BRAND PTE.LTD; Stine Goya; Hiraeth Collective
 0,Customization scope
 0,Free report customization (equivalent up to 8 analysts working days) with purchase
 0,"Addition or alteration to country, regional & segment scope."
 0,Pricing and purchase options
 0,Avail customized purchase options to meet your exact research needs. 
 0,"This report forecasts revenue growth at the global, regional, and country levels and provides an analysis of the latest industry trends and opportunities in each of the sub-segments from 2016 to 2027"
 0,"For the purpose of this study, Grand View Research has segmented the global vegan women’s fashion market report on the basis of product, distribution channel, and region:"
 0,Accessories
 0,Clothing & Apparel
 0,Footwear
 0,E-commerce
 0,Hypermarkets/Supermarkets
 0,Departmental Stores
 0,Specialty Stores
 0,Others
 0,North America
 0,The U.S.
 0,Europe
 0,Germany
 0,The U.K.
 0,France
 0,Asia Pacific
 0,China
 0,India
 0,Central & South America
 0,Brazil
 0,Middle East & Africa (MEA)
 0,The global fishing reels market size was valued at USD 4.29 billion in 2019 and is expected to grow at a compound annual growth rate (CAGR) of 4.2% from 2020 to 2027
 0,"Growing popularity of recreational activities, such as fish hunting, among millennials is expected to create a healthy demand for the product over the forecast period."
 0,The industry has been witnessing a significant demand owing to the impact of the COVID-19 pandemic
 0,This pandemic has been encouraging individuals worldwide to choose fishing or as a social distancing hobby
 0,"While the demand for the product continues to remain high globally, fishing tackle shops, most notably in the U.S., have been witnessing severe supply shortages owing to the shutting down of numerous warehouses and factories supplying fishing tackle."
 0,North America is expected to expand at a significant rate over the forecast period
 0,Rising popularity of recreational fishing in the region has been creating a healthy demand for fishing reels over the years.
 0,"According to the American Sportfishing Association (ASA), more than 49 million people in the U.S"
 0,participate in recreational fishing every year
 0,"Thus, the presence of a large number of anglers in the region is likely to make North America a lucrative market for fishing reel throughout the forecast period."
 0,China continues to be the largest exporter of fishing reels in the world
 0,"However, rising demand for handcrafted products has been strengthening the growth of the European markets, most notably Italy"
 0,"In the near term, manufacturers worldwide are likely to focus on developing handmade pieces to appeal to a varied set of consumers"
 0,"To counter the problem of corrosion in the internal components of the product, manufacturers are likely to develop new anodizing techniques and completely sealed drag systems."
 0,The spinning reel segment led the market and accounted for more than 33.0% share of the global revenue in 2019
 0,Spinning reels are preferred for their benefits such as simple and effortless operability
 0,"Spinning reels, also called spinners, are particularly beneficial when using lighter baits, such as live baits or soft plastics"
 0,Spinners are most popular among anglers who are new to fishing.
 0,The baitcasting reels are preferred by professional anglers as these products allow for longer casts in comparison with that of a spinning gear
 0,"Furthermore, these reels help anglers cast lures, such as spinner baits, crankbaits, and jigs, with increased accuracy."
 0,The offline segment dominated the fishing reel market and accounted for more than 87.0% share of the global revenue in 2019
 0,"Popular offline channels for fishing reels include specialty stores, discount stores, departmental stores, and individual sports outlets"
 0,A sizable number of consumers worldwide continue to prefer offline channels as these retail outlets help them gauge the quality and design of products
 0,"Furthermore, increasing need for purchase assistance worldwide has been driving the demand for the product."
 0,The online segment is likely to expand at the fastest CAGR over the forecast period
 0,"In contrast to that of physical stores, online retailers typically offer their products to consumers 24/7 worldwide"
 0,Recent years have witnessed various development in the online space
 0,"For instance, in June 2018, The Asian Portal Fishing, a Japan-based fishing tackle brand, launched a new transnational online website to supply approximately 20 0,000 items (fishing tackle) worldwide."
 0,North America accounted for the largest revenue share of more than 60.0% in 2019 and is expected to maintain its lead over the forecast period
 0,Led by countries such as U.S
 0,"and Canada, rising demand for the product in North America is driven by increasing popularity of ice fishing as a sport"
 0,Another prominent driving factor encouraging individuals in North American countries is the availability of a large expanse of land open to legal fishing
 0,"At a macro level, a remarkable rise in the number of angling tournaments in the U.S"
 0,over the years has been creating a healthy demand for a wide variety of fishing reels.
 0,Asia Pacific is expected to witness the fastest growth over the projected period
 0,This region offers a host of locations for game fishing
 0,"Furthermore, being budget-friendly, an average global traveler prefers Asia Pacific for its popular fishing destinations, including Toiman (South China Sea), Redand (South China Sea), Langwaki (Andaman Sea), Bali (Indonesia Sea), and Phuket (Andaman Sea)."
 0,Companies are increasingly focusing on research and development (R&D) to develop technologically advanced products to gain a competitive edge over other players
 0,"In this regard, manufacturers are increasingly employing lighter metals, such as aluminum and alloys, backed by increasing consumer demand to reduce the weight of reels."
 0,Product development continues to remain one of the most preferred competitive strategies in the market
 0,"In this regard, manufacturers have been increasingly introducing their products with stainless steel multi-lock technology"
 0,"Such fishing reels are being marketed as ideal for use in both offshore and inshore mojo lures, bunker spoons, and umbrella rigs"
 0,Some of the prominent players in the fishing reels market include:
 0,Stradic
 0,Daiwa
 0,Creed
 0,GT
 0,Penn Spinfisher
 0,Pflueger
 0,Shimano
 0,Orvis
 0,Okuma
 0,LL Bean
 0,Abu
 0,Market size value in 2020
 0,USD 4.39 billion
 0,Revenue forecast in 2027
 0,USD 5.97 billion
 0,Growth Rate
 0,CAGR of 4.2% from 2020 to 2027
 0,Base year for estimation
 0,2019
 0,Historical data
 0,2016 - 2018
 0,Forecast period
 0,2020 - 2027
 0,Quantitative units
 0,Revenue in USD million and CAGR from 2020 to 2027
 0,Report coverage
 0,"Revenue forecast, company ranking, competitive landscape, growth factors, and trends"
 0,Segments covered
 0,"Type, distribution channel, region"
 0,Regional scope
 0,North America; Europe; Asia Pacific; Central & South America; Middle East & Africa
 0,Country scope
 0,U.S.; Germany; U.K.; China; Japan; Brazil; UAE
 0,Key companies profiled
 0,Stradic; Daiwa; Creed GT; Penn Spinfisher; Pflueger; Shimano; Orvis; Okuma; LL Bean; Abu
 0,Customization scope
 0,Free report customization (equivalent up to 8 analysts working days) with purchase
 0,"Addition or alteration to country, regional & segment scope."
 0,Pricing and purchase options
 0,Avail customized purchase options to meet your exact research needs. 
 0,"This report forecasts revenue growth at the global, regional, and country levels and provides an analysis on the latest industry trends and opportunities in each of the sub-segments from 2016 to 2027"
 0,"For the purpose of this study, Grand View Research has segmented the global fishing reel market report based on type, distribution channel, and region:"
 0,Spinning Reel
 0,Baitcasting Reel
 0,Spincast Reel
 0,Others
 0,Online
 0,Offline
 0,North America
 0,The U.S.
 0,Europe
 0,Germany
 0,The U.K.
 0,Asia Pacific
 0,China
 0,Japan
 0,Central & South America
 0,Brazil
 0,Middle East & Africa
 0,UAE
 0,The global cycling wear market size was valued at USD 5.49 billion in 2019 and is expected to grow at a compound annual growth rate (CAGR) of 4.6% from 2020 to 2027
 0,Market growth is attributed to rise in awareness related to health and fitness among consumers across the globe
 0,"There has been a rise in the health-related problems, such as diabetes, high blood pressure, and obesity, amongst the youth and middle-aged people"
 0,"Many doctors and health trainers advise regular cycling practices to people, which helps to reduce the ill effects of many aforementioned medical conditions"
 0,"Additionally, consumers in urban areas nowadays prefer riding bicycles as a sustainable mode of transportation, which is expected to propel market growth over the forecast period."
 0,Manufacturers of cycling wears and gears have been coming up with a wide range of cycling apparel and gears to gain customer loyalty towards cycling wear products
 0,There has been an increase in the adoption of the high visibility cycling jacket in the market
 0,"For instance, in 2017, according to a study conducted in Demark on more than 6900 cyclists, cyclists who wear high visibility jackets had 47% less accident rate to those who are not wearing jackets"
 0,These jackets make the wearer more visible to vehicular traffic and make them stand out against their background environment
 0,Highly visible colors such as orange and yellow neon with designer retro-reflective tape are commonly used for this application.
 0,"Bicycle riding has been gaining traction amongst people in many European nations, such as the Netherlands, Finland, and Germany"
 0,"For instance, in April 2018, according to a report published by the Netherland Institute for Transport Policy, "
 0,"The climate and environment can affect cycling sports significantly, thus manufactures are focusing on fabric of the cycling wear"
 0,These wears are typically made of a unique material that has the moisture-wicking ability
 0,"Moisture-wicking is the process in which the fabric pulls sweat off the skin and brings it outside of the garment, helping the wearer to stay cool"
 0,Companies are investing significantly in research and development in these lines to design innovative products and reduce the sweating problem.
 0,"Moreover, many cycling events are organized every year around the globe with the growing popularity of adventure sports and events"
 0,"For instance, international cycling races such as Tour de Singkarak, Tour de Flores, Tour de Siak International Tour de, and Banyuwangi Ijen are some of the famous events that are organized every year in order to promote cycling and cycling tourism across the world"
 0,"However, the outbreak of coronavirus pandemic in 2020 is expected to restrain the market growth for a couple of years owing to a decrease in regional and international cycling competitions."
 0,The cycle wear apparel segment accounted for the largest revenue share in 2019 with a share of 68.8% in 2019 and is expected to maintain its lead over the forecast period
 0,There are a wide range of cycling wear apparel and clothing available in the market
 0,"The cycling wear apparel segment includes products such as leggings, shorts, gloves, beanies, tights jackets, and jersey"
 0,"These products are designed with high category clothing material offering good comfort to the rider, along with other attributes including durability, moisture resistance, waterproof, windproof, and high visibility"
 0,"Cycling wear apparels are designed to fit and support the body during riding, and thus are made up of stretchable material to offer extra comfort."
 0,Cycle wear accessories are expected to expand at the fastest CAGR of 4.7% from 2020 to 2027
 0,"One of the important cycling wears is headgear or helmets, which offer safety and comfort to the rider during cycling"
 0,Manufacturers have been coming up with new technologies and innovations in relation to the development of the helmet
 0,"Recently, a cycling product manufacturing company, Trek and Bontrager launched a new helmet with WaveCel technology that claims to provide 48 times more protection than standard EPS foam at preventing concussion from common cycling accidents."
 0,Hypermarket and supermarket stores held the largest revenue share of 39.9% in 2019
 0,Several buying schemes and availability of a wide range of products in these stores with a special presence of sports product segments are driving the segment
 0,"Companies such Decathlon, Nike, and Adidas are some of the brands offering major discounts on products through these retail sales channels"
 0,"Moreover, growing trend of sales representatives in these stores assist the consumers in attaining pleasant shopping experience has increased the importance of these channels."
 0,Europe accounted for the largest revenue share of 29.1% in 2019 and is expected to maintain its lead over the forecast period
 0,Europe has been witnessing impressive growth in promoting riding bicycles and that it has further penetrated the market with the introduction of electric bicycles
 0,"According to the World Bank in 2016, close to 70% of the population in Finland use bicycles for various activities, including office commute and leisure ride."
 0,Asia Pacific is anticipated to expand at the fastest CAGR of 5.0% over the forecast period
 0,"Countries such as South Korea, Japan, and China have shown great interest in cycling events, which is expected to drive the regional market"
 0,Consumers’ inclination towards use of quality cycling wear apparel and safety gear is increasing cycling activities in the country
 0,China is one of the prominent markets in this region and Japan and South Korea are the upcoming markets in the field of cycling wear apparel in Asia Pacific.
 0,Leading players in the market are stressing on product innovation and new product development in order to gain a greater market share at the global level
 0,"For instance, Rapha, a cycle product manufacturer, recently launched a new turbo- specific clothing range for indoor cycling"
 0,"This clothing range includes sleeveless t-shirts, core cargo shorts, and indoor training towel, which will be effective in sweat reduction"
 0,Some of the prominent companies operating in the global cycling wear market are:
 0,LUMIERE CYCLING
 0,GIRO SPORT DESIGN
 0,Castelli Cycling
 0,Rapha Racing Limited
 0,Champion System
 0,United Apparel Solution Ltd
 0,(Cuore of Switzerland Inc.)
 0,ASSOS of Switzerland GmbH
 0,Endura Limited
 0,Isadore apparel
 0,2XU
 0,Market size value in 2020
 0,USD 4.37 billion
 0,Revenue forecast in 2027
 0,USD 7.88 billion
 0,Growth Rate
 0,CAGR of 4.6% from 2020 to 2027
 0,Base year for estimation
 0,2019
 0,Historical data
 0,2016 - 2018
 0,Forecast period
 0,2020 - 2027
 0,Quantitative units
 0,Revenue in USD million and CAGR from 2020 to 2027
 0,Report coverage
 0,"Revenue forecast, company ranking, competitive landscape, growth factors, and trends"
 0,Segments covered
 0,"Product, distribution channel, region"
 0,Regional scope
 0,North America; Europe; Asia Pacific; Central & South America; MEA
 0,Country scope
 0,U.S.; U.K.; Germany; France; China; Japan; Brazil
 0,Key companies profiled
 0,LUMIERE CYCLING; GIRO SPORT DESIGN; Castelli Cycling; Rapha Racing Limited; Champion System; United Apparel Solution Ltd
 0,(Cuore of Switzerland Inc.); ASSOS of Switzerland GmbH; Endura Limited; Isadore apparel; 2XU
 0,Customization scope
 0,Free report customization (equivalent up to 8 analysts working days) with purchase
 0,"Addition or alteration to country, regional & segment scope."
 0,Pricing and purchase options
 0,Avail customized purchase options to meet your exact research needs. 
 0,"This report forecasts revenue growth at the global, regional, and country levels and provides an analysis on the latest industry trends and opportunities in each of the sub-segments from 2016 to 2027"
 0,"For the purpose of this study, Grand View Research has segmented the global cycling wear market report on the basis of product, distribution channel, and region:"
 0,Cycle Wear Apparel
 0,Cycle Wear Accessories
 0,Hypermarket and Supermarket
 0,Sports Variety Stores
 0,E-commerce
 0,Others
 0,North America
 0,The U.S.
 0,Europe
 0,Germany
 0,France
 0,The U.K.
 0,Asia Pacific
 0,China
 0,Japan
 0,Central & South America
 0,Brazil
 0,Middle East & Africa (MEA)
 0,The global laptop messenger bags market size was valued at USD 496.5 million in 2019 and is expected to grow at a compound annual growth rate (CAGR) of 3.1% from 2020 to 2027
 0,Increasing use of 
 0,Laptop messenger bags are popular among consumers for their ease of carrying and lightweight
 0,Prominent market participants have been focusing on employing high-end technology to manufacture lightweight fabric due to growing consumer interest in lightweight laptop bags
 0,"Furthermore, increasing global fares on luggage, coupled with weight limitations enforced by various airlines, are driving the demand for lightweight laptop carry cases, including messenger bags."
 0,"Laptop messenger bags are popular owing to features, such as GPS tracking, multiple storage options, and inbuilt USB charging port"
 0,"Market players are expected to use advanced technology to target a wide variety of customers, including millennials"
 0,"In this respect, smart laptop messenger bags are likely to redefine the product demand over the forecast period."
 0,The trend of 
 0,Availability of numerous substitutes also challenges the market
 0,"Backpacks, sleeves, briefcases, and rollers are the substitutes for laptop messenger bags"
 0,Backpacks are among the most popular laptop carry cases and are among the most significant alternatives to laptop messenger bags
