 0,"Revenue forecast, company ranking, competitive landscape, growth factors, and trends"
 0,Segments covered
 0,"Capsule, end user, region"
 0,Regional scope
 0,North America; Europe; Asia Pacific; Central & South America; Middle East & Africa
 0,Country scope
 0,U.S.; Russia; Germany; Indonesia; China; Brazil; South Africa
 0,Key companies profiled
 0,"Philip Morris International Inc.; Imperial Brands plc; Korea Tobacco & Ginseng Corporation; Alfred Dunhill, Ltd.; R.J"
 0,Reynolds Tobacco Company; British American Tobacco; Commonwealth Brands; Liggett Group; Lorillard Tobacco; Essentra plc
 0,Customization scope
 0,Free report customization (equivalent up to 8 analysts working days) with purchase
 0,Addition or alteration to country; regional & segment scope.
 0,Pricing and purchase options
 0,Avail customized purchase options to meet your exact research needs. 
 0, 
 0,"This report forecasts revenue growth at the global, regional, and country levels and provides an analysis on the latest industry trends and opportunities in each of the sub-segments from 2015 to 2025"
 0,"For the purpose of this study, Grand View Research has segmented the global menthol cigarette market report on the basis of the capsule, end-user, and region:"
 0,Single Capsule
 0,Double Capsule 
 0,Male
 0,Female
 0,North America
 0, The U.S.
 0,Europe
 0,Russia
 0, Germany
 0,Asia Pacific
 0,China
 0, Indonesia
 0,Central & South America
 0, Brazil
 0,Middle East & Africa (MEA)
 0,South Africa
 0,The global cigar and cigarillos market size was valued at USD 16.99 billion in 2018
 0,It is expected to expand at a CAGR of 3.1% during the forecast period
 0,The global market is expected to witness substantial growth owing to the increasing number of luxury hotels with cigar lounges
 0,"Following the worldwide ban on smoking in public places, such lounges and bars are making an appearance in luxury hotels and bars"
 0,"For instance, DUKES Hotel of London welcomes its stogie-loving visitors in the cognac and cigar garden"
 0,The secluded courtyard located behind the hotel offers a list of cognacs to accompany the Cuban cigar.
 0,"Introduction of various flavors including wine, tea, chocolate, and vanilla to mask harsh taste of "
 0,China is one of the prominent markets for premium cigars and is expected to become largest markets in the upcoming years
 0,"Traditionally, cigar was considered as luxury tobacco product, which is purchased by rich, middle aged consumers"
 0,"However, increasing penetration of low cost product coupled with growing number of young billionaires in China is expected to promote the usage on a domestic level"
 0,"Moreover, Cuban cigar manufacturers are focusing on increasing their market reach through the strategic collaboration."
 0,"For instance, in 2017, Habanos S.A"
 0,signed an agreement with the China National Tobacco Corporation to increase import of premium cigar
 0,The company is focusing on training their sales force along with increasing spending for the expansion of their distribution networks
 0,"However, Habanos S.A"
 0,"is facing challenge in increasing awareness related to the various brands such as Montecristo, Romeo, and Julieta, on account of increased visibility of Cohiba, one of the island’s leading brand popular among Chinese consumers."
 0,"Demand for Cuban cigar is expected to witness significant growth in India on account of increasing concentration of cigar clubs in cities including New Delhi, Bengaluru, Mumbai, and Kolkata"
 0,The demand is attributed to growing brand awareness among the neo rich coupled with increased influence of western culture among young consumers
 0,"However, the lack of adequate choice and limited marketing due of stringent government regulations on advertising of tobacco-related products are expected to hinder the growth in near future."
 0,Mass cigar held the largest market share of 82.3% in 2018
 0,"Compared to premium, mass products are likely to be most preferred by young consumers"
 0,"Mass category products are machine made and are less expensive compared to premium category products, owing to which, young consumer, mostly high school students opt for mass category products"
 0,"In addition, mass category products are available in various flavors such as mint, chocolate, menthol, and vanilla which has led to rise in consumption."
 0,Premium cigar segment is expected to witness the fastest growth over the forecast period on account of growing demand from luxury hotels and bars
 0,"Furthermore, premium products are handmade and are witnessing significant demand from developed markets such as the U.S., U.K., and China"
 0,Growing popularity of unique taste and favor is positively influencing the demand for this category for the past few years
 0,"Moreover, online stores are witnessing strong demand for premium category which is expected to drive the market during the forecast period."
 0,"In 2018, tobacco/no flavor segment led the market in terms of revenue share and is expected to maintain its dominant position over the forecast period"
 0,The segment was valued at USD 12.05 billion in 2018 and is expected to expand at a CAGR of 3.0% from 2019 to 2025
 0,"Most of NORDIC population preferred no flavor tobacco products, followed by chocolate and vanilla flavored tobacco products."
 0,Flavored products are expected to witness significant growth over the forecast period owing to the rising popularity of flavored products among young consumers
 0,Moreover the increasing number of female consumers is expected to boost the scope of demand for flavored products over the forecast period
 0,"Among the various flavors, fruit-based flavors are the most preferred, but sale of non-descriptive flavor such as wine, tea, and Jazz is expected to witness substantial growth in the near future."
 0,"North America held the largest market share in 2018, attributed to the growing demand for premium cigars from luxury hotels and bars in U.S"
 0,"According to the Cigar Association of America, about 330 million sticks were shipped to U.S., in 2017, making it the biggest import year in nearly two decades."
 0,"Nicaragua led the import market and was the largest exporter of premium cigars for two consecutive years, beating the Dominican Republic once again"
 0,Increased import from Nicaragua was due the love for unique taste of Nicaragua tobacco among the U.S
 0,consumers
 0,"However, stringent rules and norm by the U.S"
 0,Food and Drug Administration (FDA) for the launch of new products coupled with the heavy taxation by the U.S
 0,government is expected to restrain the growth in near future.
 0,Europe is expected to expand at a CAGR of 1.9% over the forecast period
 0,Increasing preference by women is projected to drive the regional market
 0,Increasing number of female smokers in the countries like Poland and Russia is expected to boost the demand in Europe
 0,"Furthermore, increasing taxation on cigarettes, their bad reputation coupled with increased prices has led to a shift in consumer preference in the region."
 0,Asia Pacific is expected to register a CAGR of 8.9% over the forecast period
 0,The demand for Cuban cigar is growing in the region
 0,China was the largest regional market and held 48.35% share of Asia Pacific cigar and cigarillos market
 0,Cigar is considered as a luxury product to accompany drinks and meals
 0,The moments of meal with the family and friends is considered vital in the Chinese tradition and people organize ceremonial meals for celebrating important occasions
 0,"This time is considered appropriate in the country to share drinks and cigars with the family, friends, and co-workers, which in turn has led to a rise in demand from China."
 0,The global market is getting more and more diversified with the availability of products in all the range and flavors
 0,"The top most competitors are Nicaragua, the Dominican Republic, Honduras, and Brazil"
 0,In recent days various verities are launch by the manufactures to gain greater market share
 0,Many regional and domestic players are entering into the market with unique and innovative products to gain customer base
 0,"Recently, in Europe, Switzerland entered into cigar manufacturing and Swiss brand “Davidoff” which is gaining popularity as a brand with a unique quality of the product"
 0,"Moreover, Nicaragua innovated organic cigar with a brand name “Plasencia”, which is expected to gain popularity in Asia, especially in China."
 0,Market size value in 2020
 0,USD 17.96 billion
 0,Revenue forecast in 2025
 0,USD 21.02 billion
 0,Growth Rate
 0,CAGR of 3.1% from 2019 to 2025
 0,Base year for estimation
 0,2018
 0,Historical data
 0,2015 - 2017
 0,Forecast period
 0,2019 - 2025
 0,Quantitative units
 0,Revenue in USD million/billion and CAGR from 2019 to 2025
 0,Report coverage
 0,"Revenue forecast, company ranking, competitive landscape, growth factors, and trends"
 0,Segments covered
 0,"Product, flavor, region"
 0,Regional scope
 0,North America; Europe; Asia Pacific; Central & South America; Middle East & Africa
 0,Country scope
 0,U.S.; U.K.; Germany; Spain; France; China; Australia
 0,Key companies profiled
 0,"Altria Group, Inc.; Habanos S.A.; Scandinavian Tobacco Group A/S; Gurkha Cigars; Swisher International, Inc.; Agio Cigars; Swedish Match AB; OETTINGER DAVIDOFF AG; Drew Estate; Trendsettah USA, Inc."
 0,Customization scope
 0,Free report customization (equivalent up to 8 analysts working days) with purchase
 0,"Addition or alteration to country, regional & segment scope."
 0,Pricing and purchase options
 0,Avail customized purchase options to meet your exact research needs. 
 0,"This report forecasts revenue growth at global, regional, and country levels and provides an analysis of the latest industry trends in each of the sub-segments from 2015 to 2025"
 0,"For the purpose of this study, Grand View Research has segmented the global cigar and cigarillos market report on the basis of product, flavor, and region:"
 0,Mass
 0,Premium
 0,Tobacco/No Flavor
 0,Flavored
 0,North America
 0,The U.S.
 0,Europe
 0,Germany
 0,The U.K.
 0,Spain
 0,France
 0,Asia Pacific
 0,China
 0,Australia
 0,Central & South America
 0,Middle East & Africa
 0,The U.S
 0,beer and cider market is expected to witness significant growth and was valued at USD 110.46 billion in 2016
 0,Beer is popular in the U.S
 0,and is sold widely compared to other spirits
 0,"Moreover, the market is driven by increased competition with various types of beers & ciders available"
 0,"In addition to this, various establishments such as microbrewery and brewpub are expected to foster the market growth in the country."
 0,The growing popularity of 
 0,"Certain factors that are expected to restrain the market growth include millennial generation becoming health conscious thereby, lowering the consumption of alcoholic beverages"
 0,"Furthermore, individuals in the legal drinking age group are less likely to consume alcoholic beverages which are also anticipated to lower the market growth rate."
 0,The high cost of investment and distribution of beer and cider further prevents new players from entering the market.
 0,The beer segment is the highest revenue-generating segment in 2016 and was valued at USD 108.29 billion
 0,The popularity of the beverage in the country enables it to occupy a large market share and its availability in various varieties enables it to be widely consumed across the country
 0,The wide variety of available beer has led to high competition in this segment.
 0,Ciders have a lower market share compared to beer as the raw materials are expensive compared to raw materials required to produce beer
 0,"Moreover, the penetration of cider is less compared to the penetration of beer in the U.S"
 0,"In addition to this, types of cider such as hard cider is expected to gain consumer attraction."
 0,The market comprises a large number of players among which few players are global companies that have a large market share and higher penetration in the regional markets
 0,Small breweries on the other hand generally serve the local market
 0,Smaller players are primarily involved in producing craft beer
 0,The competition is mainly characterized based on product innovation in terms of the quality of the beer.
 0,"Prominent players in the market include Anheuser-Busch InBev, SABMiller plc, Heineken N.V., Carlsberg Breweries A/S"
 0,These players have significant market share and have multiple brands of beer under their name that are available across various regions.
 0,The base year for estimation
 0,2016
 0,Actual estimates/Historical data
 0,2014 - 2016
 0,Forecast period
 0,2017 - 2025
 0,Market representation
 0,Revenue in USD Billion and CAGR from 2017 to 2025
 0,Country scope
 0,The U.S.
 0,Report coverage
 0,"Revenue forecast, company ranking, competitive landscape, growth factors, and trends"
 0,15% free customization scope (equivalent to 5 analyst working days)
 0,"If you need specific market information that is not currently within the scope of the report, we will provide it to you as a part of the customization."
 0,"The global craft beer market size was valued at USD 85.02 billion in 2015 and is expected to witness significant growth over the forecast period owing to the increasing penetration of the product in countries including South Africa, Australia, New Zealand, and Brazil"
 0,The rising consumer preference for flavored and low ABV beer is expected to be the key aspects of the market growth.
 0,The growing awareness among the consumers with respect to the wide range of flavors and styles of the craft beer coupled with low alcohol by volume (ABV) percentage is expected to drive demand over the forecast period
 0,"Furthermore, the growing number of craft beer enthusiasts in the U.S., Germany, Belgium, UK and Japan is expected to have a positive impact on the market."
 0,The U.S
 0,"market experienced sluggish growth post-introduction period of the product, owing to the consumer preference for mainstream beer over craft beer"
 0,"However, advancement in the brewing process and the use of premium quality raw materials has improved the overall characteristics of the product, which has intrigued the attention of the consumers."
 0,The global number of craft brewers is increasing rapidly on account of the growing demand for the product
 0,"The microbreweries count in Europe increased over 740 breweries from 2014 to 2015; this increase can be attributed to the growing consumption of the product in the region, even though the overall beer consumption is decreasing in most countries of the region."
 0,"IPA, amber lager, and amber ale are the most preferred beer among the different styles of craft beer"
 0,These styles are mostly consumed through different hospitality distribution channels in developed countries
 0,"This can be attributed to the high price of craft beer in bars, restaurants, etc"
 0,coupled with high consumer spending capacity.
 0,"The government in countries including Australia, New Zealand, Belgium, Mexico, China, and UK are promoting the production of craft beer and incorporation of new breweries on account of the positive contribution of the industry towards economic development and employment generation."
 0,"The on-trade distribution refers to the sale of the alcoholic drinks in bars, restaurants, clubs, pubs and other distribution channels in the hospitality industry"
 0,"The on-trade craft beer is expensive as compared to off-trade; as a result, the craft beer market is growing substantially in developed economies on account of the high hospitality industry growth coupled with high consumers’ spending ability."
 0,"Off-trade distribution (distribution through retail stores, wholesalers, and online stores) market is expected to witness significant growth in developing and emerging economies on account of the low to medium consumer buying power"
 0,"In addition, the growing penetration of the product in countries including Brazil, China, India, and Mexico with increasing consumer spending power is expected to compliment the growth over the next nine years."
 0,Europe is expected to account for the largest market share in terms of value as well as volume
 0,High consumption coupled with consumer preference for flavored brews is expected to drive craft beer market growth over the projected period
 0,Germany and UK are the largest consumers of this spirit accounting for over 25% of the overall revenue share.
 0,The Middle East & Africa (MEA) and Central & South America are expected to be the fastest growing regions owing to the rising penetration of the product in Brazil and South Africa
 0,Low ABV with a wide range of flavors is expected to be the major factor for the market growth in these countries
 0,"In addition, the increasing penetration in United Arab Emirates is likely to contribute to the market growth over the next nine years."
 0,The market in North America is expected to witness growth on account of the shift in the consumer preference for craft brews over the mainstream 
 0,The key strategies adopted by the major players include product innovation and the introduction of the product in the high potential markets to expand their global reach
 0,The major players include D.G
 0,"Yuengling and Son, The Boston Beer Company, The Gambrinus Company, Chimay Beers and Cheeses, Stone & Wood Brewing Co., Vagabund, Lagunitas Brewing Company and New Belgium Brewing Company."
 0,The companies such as Chimay Beers and Cheeses have near monopoly in the local market with the global presence
 0,The Boston Beer Company outsources the production of raw materials and distributes through direct and indirect channels.
 0,Base year for estimation
 0,2016
 0,Actual estimates/Historical data
 0,2014 - 2016
 0,Forecast period
 0,2017 - 2025
 0,Market representation
 0,Revenue in USD Billion and CAGR from 2016 to 2025
 0,Regional scope
 0,"North America, Europe, Asia Pacific, Central & South America, Middle East & Africa"
 0,Country scope
 0,"U.S., Germany, UK, Australia, China, Indian, Japan, New Zealand, Brazil, South Africa"
 0,Report coverage
 0,"Revenue forecast, competitive landscape, growth factors and trends"
 0,15% free customization scope(equivalent to 5 analyst working days)
 0,"If you need specific market information, which is not currently within the scope of the report, we will provide it to you as a part of customization"
 0,The global structural insulated panels market size was valued at USD 11.17 billion in 2020 and is expected to grow at a compound annual growth rate (CAGR) of 5.5% from 2021 to 2028
 0,Favorable green building standards and regulations for the adoption of building insulation materials for lowering the overall energy consumption coupled with the growing investments in the development of cold chain infrastructure across the world are the key factors that are expected to drive the market
 0,"Structural insulated panels (SIPs) are expected to gain wide acceptance globally as they are lightweight, have a better external appearance, and can improve the thermal performance of buildings"
 0,"In the U.S., as per the Federal Energy Policy Act 2005, a tax credit of up to USD 2,000 is provided for builders of new energy-efficient homes that are constructed as per the standards of Federal Manufactured Homes Construction and Safety Standards."
 0,"In 202 0, the polystyrene product segment led the U.S"
 0,structural insulated panels market owing to robust insulation property and cost-effectiveness of polystyrene
 0,Growing investments in the renovation of old building structures are expected to drive future product demand within the U.S
 0,market.
 0,Structural insulated panels are widely used in the construction of warehouses owing to their ability to reduce the overall construction time
 0,The growth of the 
 0,Structural insulated panels are fabricated at manufacturing facilities and shipped to the job site in a ready-to-install state
 0,"Metal sheets are emerging as a preferred facing material owing to their durability, fireproof property, and superior surface finish"
 0,"Moreover, insulated metal panels are available in a variety of colors, thus making them suitable for direct application on building exteriors."
 0,"Raw materials used for manufacturing structural insulated panels include Polyisocyanurate (PIR), "
 0,Polystyrene led the market and accounted for more than 72.0% share of the global revenue in 2020 and will retain the leading position throughout the forecast period
 0,This growth can be credited to high demand for these products due to their cost-effectiveness and dust & moisture resistance
 0,"In addition, the tough and resilient surface of polystyrene offers a higher degree of puncture resistance and quakeproof property"
 0,"However, the polyurethane segment is estimated to register the fastest CAGR from 2021 to 2028."
 0,"Polyurethane structural insulated panels are relatively more expensive than other product types, such as polystyrene and glass wool"
 0,These panels are widely preferred in the insulation of cold chain storages owing to their superior thermal insulation and vapor diffusion resistance properties
 0,"Thus, the growing emphasis on the development of cold chain infrastructures is expected to drive the product demand over the forecast period"
 0,"The glass wool segment is expected to grow at a CAGR of 5.8% over the forecast period owing to superior thermal insulation, fire resistance, and noise insulation properties of glass wool."
 0,Walls & floors led the market and accounted for more than 46.0% share of the global revenue in 2020
 0,Growing awareness about the economic advantages of installing effective building insulation is driving the segment growth
 0,Insulation of walls is one of the essential elements to enhance the energy efficiency of buildings
 0,"Insulated walls along with insulated floors create a protective envelope, which eliminates heat transfer from the external environment through conduction and convection radiation and thereby reduce the energy expenditure on heating or cooling of a building structure."
 0,The product is widely used in the cold storage industry owing to its superior structural strength and insulation properties
 0,"SIPs find application in walls, ceilings, and roofs for cold storage, freezers, and food processing buildings and can also be retrofitted to the existing controlled environment structures, such as dry warehouse, where maintaining temperature and insulation values is of immense importance"
 0,The recent global pandemic has generated a significant product demand for the establishment of cold chain infrastructure to ensure the safety of the Covid-19 vaccines and ensure seamless last-mile delivery.
 0,North America dominated the market and accounted for over 38.0% share of global revenue in 2019
 0,"Increased demand from the residential sector, extensively developed cold chain and logistics industry, and the government initiatives to develop social infrastructure are some of the major factors responsible for the market growth in North America"
 0,Rising awareness regarding the benefits of insulation of building structures is expected to drive the market in the coming years.
 0,The Asia Pacific is expected to be the fastest-growing regional market due to the rapid growth of the residential and commercial construction sectors and the adoption of various green building standards
 0,The Middle East and Africa is expected to register a significant CAGR over the forecast period
 0,The region imports majority of its food products from overseas owing to the dry climate and lack of rainfall
 0,The UAE has emerged as the import and trading hub for food products in the region
 0,"As a result, it is witnessing growing investments in the establishment of cold storage and cold chain logistics, which drives the demand for structural insulated panels."
 0,Major companies in the market are focusing on expanding their product portfolio by developing cost-effective insulation products with enhanced properties
 0,The manufacturers are also engaged in the product installation through their network of certified contractors and installers
 0,"Installation of these systems needs expert services, which can affect the overall price"
 0,"Companies invest significantly in R&D activities related to product manufacturing, supply, and installation, which results in dynamic market conditions"
 0,Some prominent players in the global structural insulated panels market include:
 0,Metl-Span
 0,Kingspan Group
 0,PFB Corporation
 0,Isopan
 0,KPS Global
 0,American Insulated Panel
 0,Structural Panels Inc.
 0,All Weather Insulated Panels
 0,Ingreen Systems Corp.
 0,Owens Corning
 0,Market size value in 2021
 0,USD 11.85 billion
 0,Revenue forecast in 2028
 0,USD 17.19 billion
 0,Growth Rate
 0,CAGR of 5.5% from 2021 to 2028
 0,Base year for estimation
 0,2020
 0,Historical data
 0,2017 - 2019
 0,Forecast period
 0,2021 - 2028
 0,Quantitative units
 0,"Volume in million square feet, revenue in USD million/billion, and CAGR from 2021 to 2028"
 0,Report coverage
 0,"Revenue forecast, volume forecast, competitive landscape, growth factors, and trends"
 0,Segments covered
 0,"Product, application, region"
 0,Regional scope
 0,North America; Europe; Asia Pacific; Central & South America; Middle East & Africa
 0,Country scope
 0,U.S.; Canada; Mexico; U.K.; Germany; Italy; China; Japan; India; Brazil; Argentina; UAE
 0,Key companies profiled
 0,Metl-Span; Kingspan Group; PFB Corp.; Isopan; KPS Global; American Insulated Panel; Structural Panels Inc.; All Weather Insulated Panels; Ingreen Systems Corp.; Owens Corning
 0,Customization scope
 0,Free report customization (equivalent to up to 8 analysts working days) with purchase
 0,"Addition or alteration to country, regional & segment scope."
 0,Pricing and purchase options
